[
  {
    "id": "met-451683",
    "title": "Bifolium from a Qur'an Manuscript",
    "creator": null,
    "year": "15th century",
    "category": "Rare Books & Manuscripts",
    "description": "A Qur'an bifolium combines Arabic text with diagonally arranged Persian translations, framed by colorful calligraphy and ornament.",
    "institution": "The Metropolitan Museum of Art",
    "item_url": "https://www.metmuseum.org/art/collection/search/451683",
    "rights_status": "Public Domain",
    "rights_url": "https://collectionapi.metmuseum.org/public/collection/v1/objects/451683",
    "rights_evidence": "Official item API reports isPublicDomain: true and supplies an image URL. The Met Open Access policy places eligible images under CC0.",
    "formats": [
      "JPEG"
    ],
    "region": "South Asia — India, probably Gujarat",
    "tags": [
      "manuscript",
      "calligraphy",
      "translation"
    ],
    "date_verified": "2026-10-30"
  },
  {
    "id": "met-456074",
    "title": "Bifolium from the \"Nurse's Qur'an\" (Mushaf al-Hadina)",
    "creator": null,
    "year": "ca. 410 AH/1019–20 CE",
    "category": "Rare Books & Manuscripts",
    "description": "A parchment bifolium preserves a portion of the manuscript known as the Nurse's Qur'an, a striking example of medieval North African book arts.",
    "institution": "The Metropolitan Museum of Art",
    "item_url": "https://www.metmuseum.org/art/collection/search/456074",
    "rights_status": "Public Domain",
    "rights_url": "https://collectionapi.metmuseum.org/public/collection/v1/objects/456074",
    "rights_evidence": "Official item API reports isPublicDomain: true and supplies an image URL. The Met Open Access policy places eligible images under CC0.",
    "formats": [
      "JPEG"
    ],
    "region": "North Africa — Tunisia, probably Qairawan",
    "tags": [
      "manuscript",
      "calligraphy",
      "parchment"
    ],
    "date_verified": "2026-10-30"
  },
  {
    "id": "met-468941",
    "title": "Book of Hours",
    "creator": "Gilles Hardouyn (publisher); Germain Hardouyn (artist)",
    "year": "1518–21",
    "category": "Rare Books & Manuscripts",
    "description": "A Book of Hours joins printed illustration and hand illumination, revealing a meeting point between manuscript craft and early book production.",
    "institution": "The Metropolitan Museum of Art",
    "item_url": "https://www.metmuseum.org/art/collection/search/468941",
    "rights_status": "Public Domain",
    "rights_url": "https://collectionapi.metmuseum.org/public/collection/v1/objects/468941",
    "rights_evidence": "Official item API reports isPublicDomain: true and supplies an image URL. The Met Open Access policy places eligible images under CC0.",
    "formats": [
      "JPEG"
    ],
    "region": "Europe — France",
    "tags": [
      "book-history",
      "illumination",
      "printing"
    ],
    "date_verified": "2026-10-30"
  },
  {
    "id": "met-684184",
    "title": "Book of Hours",
    "creator": "Simon Bening",
    "year": "ca. 1530–35",
    "category": "Rare Books & Manuscripts",
    "description": "Simon Bening compresses an illuminated devotional world into a tiny parchment book; the record offers images of selected openings.",
    "institution": "The Metropolitan Museum of Art",
    "item_url": "https://www.metmuseum.org/art/collection/search/684184",
    "rights_status": "Public Domain",
    "rights_url": "https://collectionapi.metmuseum.org/public/collection/v1/objects/684184",
    "rights_evidence": "Official item API reports isPublicDomain: true and supplies an image URL. The Met Open Access policy places eligible images under CC0.",
    "formats": [
      "JPEG"
    ],
    "region": "Europe — present-day Belgium",
    "tags": [
      "illumination",
      "parchment",
      "devotion"
    ],
    "date_verified": "2026-10-30"
  },
  {
    "id": "met-320635",
    "title": "Tälsäm or yä bərana kətab (healing scroll)",
    "creator": null,
    "year": "19th century",
    "category": "Rare Books & Manuscripts",
    "description": "Written prayers and painted talismans share a long parchment healing scroll, documenting a distinctive Ethiopian devotional tradition.",
    "institution": "The Metropolitan Museum of Art",
    "item_url": "https://www.metmuseum.org/art/collection/search/320635",
    "rights_status": "Public Domain",
    "rights_url": "https://collectionapi.metmuseum.org/public/collection/v1/objects/320635",
    "rights_evidence": "Official item API reports isPublicDomain: true and supplies an image URL. The Met Open Access policy places eligible images under CC0.",
    "formats": [
      "JPEG"
    ],
    "region": "East Africa — Ethiopia",
    "tags": [
      "scroll",
      "parchment",
      "Ethiopian-art"
    ],
    "date_verified": "2026-10-30"
  },
  {
    "id": "brion-africa-1786",
    "title": "Africa, prepared for the study of geography",
    "creator": "Louis Brion de la Tour; Louis-Charles Desnos",
    "year": "Possibly 1786",
    "category": "Historical Maps & Atlases",
    "description": "A hand-colored teaching map with a decorative border, useful for examining the presentation of Africa in eighteenth-century European atlases.",
    "institution": "Texas A&M University Libraries",
    "item_url": "https://digitalcollections.library.tamu.edu/do/e93eea73-e10a-4581-8766-86ae97b1aa8b",
    "rights_status": "Public Domain — United States",
    "rights_url": "https://digitalcollections.library.tamu.edu/do/e93eea73-e10a-4581-8766-86ae97b1aa8b",
    "rights_evidence": "The item record labels this digitized map No Copyright - United States and explicitly limits its public-domain assessment to United States law.",
    "formats": [
      "TIFF",
      "IIIF"
    ],
    "region": "Europe (France); subject: Africa",
    "tags": [
      "Africa",
      "teaching",
      "cartography"
    ],
    "date_verified": "2026-10-30"
  },
  {
    "id": "official-war-maps-1898",
    "title": "Official war maps: Cuba and the West Indies",
    "creator": "Rand McNally and Company (publisher)",
    "year": "1898",
    "category": "Historical Maps & Atlases",
    "description": "A folding commercial map publication documenting how Cuba and the Caribbean were presented to readers during the Spanish-American War.",
    "institution": "Texas A&M University Libraries",
    "item_url": "https://digitalcollections.library.tamu.edu/do/4bb167b9-3bd6-400a-a0c6-690beeac8667",
    "rights_status": "Public Domain — United States",
    "rights_url": "https://digitalcollections.library.tamu.edu/do/4bb167b9-3bd6-400a-a0c6-690beeac8667",
    "rights_evidence": "The item record labels this digitized map No Copyright - United States and explicitly limits its public-domain assessment to United States law.",
    "formats": [
      "TIFF",
      "IIIF"
    ],
    "region": "North America (United States); subject: Caribbean",
    "tags": [
      "Cuba",
      "Caribbean",
      "cartography"
    ],
    "date_verified": "2026-10-30"
  },
  {
    "id": "speed-kingdome-china",
    "title": "The kingdome of China",
    "creator": "John Speed",
    "year": "1626",
    "category": "Historical Maps & Atlases",
    "description": "A map framed by figures and city views; its depiction of Korea as an island reveals the limits of contemporary European cartography.",
    "institution": "Texas A&M University Libraries",
    "item_url": "https://digitalcollections.library.tamu.edu/do/8b54f836-f9f2-43f7-8eda-0d2b89ca6f5d",
    "rights_status": "Public Domain — United States",
    "rights_url": "https://digitalcollections.library.tamu.edu/do/8b54f836-f9f2-43f7-8eda-0d2b89ca6f5d",
    "rights_evidence": "The item record labels this digitized map No Copyright - United States and explicitly limits its public-domain assessment to United States law.",
    "formats": [
      "TIFF",
      "IIIF"
    ],
    "region": "Europe (England); subject: East Asia",
    "tags": [
      "cartography",
      "China",
      "early maps"
    ],
    "date_verified": "2026-10-30"
  },
  {
    "id": "ortelius-theatrum-1570",
    "title": "Theatrum orbis terrarum",
    "creator": "Abraham Ortelius; Franz Hogenberg",
    "year": "1570",
    "category": "Historical Maps & Atlases",
    "description": "A colored atlas whose sequence of maps lets readers compare sixteenth-century representations of different parts of the world.",
    "institution": "Zentralbibliothek Zürich / e-rara",
    "item_url": "https://www.e-rara.ch/zuz/content/titleinfo/23011918",
    "rights_status": "Public Domain",
    "rights_url": "https://www.e-rara.ch/zuz/content/titleinfo/23011918",
    "rights_evidence": "The item record explicitly applies the Creative Commons Public Domain Mark to this digitized work.",
    "formats": [
      "IIIF"
    ],
    "region": "Europe (Antwerp); subject: world",
    "tags": [
      "atlas",
      "cartography"
    ],
    "date_verified": "2026-10-30"
  },
  {
    "id": "met-444408",
    "title": "Astrolabe of ‘Umar ibn Yusuf ibn ‘Umar ibn ‘Ali ibn Rasul al-Muzaffari",
    "creator": "‘Umar ibn Yusuf ibn ‘Umar ibn ‘Ali ibn Rasul al-Muzaffari",
    "year": "dated 690 AH/1291 CE",
    "category": "Astronomy & Celestial Charts",
    "description": "A dated Yemeni astrolabe turns celestial calculation into a finely worked brass instrument with silver inlay.",
    "institution": "The Metropolitan Museum of Art",
    "item_url": "https://www.metmuseum.org/art/collection/search/444408",
    "rights_status": "Public Domain",
    "rights_url": "https://collectionapi.metmuseum.org/public/collection/v1/objects/444408",
    "rights_evidence": "Official item API reports isPublicDomain: true and supplies an image URL. The Met Open Access policy places eligible images under CC0.",
    "formats": [
      "JPEG"
    ],
    "region": "West Asia — Yemen",
    "tags": [
      "astrolabe",
      "astronomy",
      "instrument"
    ],
    "date_verified": "2026-10-30"
  },
  {
    "id": "ferguson-astronomy-1794",